AnimalName,symptoms1,symptoms2,symptoms3,symptoms4,symptoms5,Dangerous,AnimalClass,Симптомы_рус
fowl,Fever,Nasal discharge,Respiratory distress,Pox lesion,Pain,Yes,птица,"Высокая температура, Носовая выделение, Респираторный дистресс, Поражение оспы, Боль"
fowl,Fever,Dark colored bloody,Incoordination,Difficulty in breathing,Terminal convulsion,Yes,птица,"Высокая температура, Темный цвет кровавый, Нарушение, Трудность в дыхании, Терминальная судорога"
fowl,Fever,Dysentery,Swelling,Immediate death,Pain,Yes,птица,"Высокая температура, Дизентерия, Припухлость, Немедленная смерть, Боль"
fowl,Fever,Respiratory distress,Mucous discharge,Reduce feed,Weight gain,Yes,птица,"Высокая температура, Респираторный дистресс, Слизистый разряд, Уменьшить корм, Увеличение веса"
fowl,Decreased milk,Holding limbs off the ground,Weight loss,Lameness,Wool production,Yes,птица,"Снижение молока, Удерживая конечности, Потеря веса, Хромота, Производство шерсти"
fowl,Swelling of udder,change in milk,Swollen,Tender to touch,Pain,Yes,птица,"Обухание выменения, Изменение в молоке, Вздутый, Нежный, чтобы прикоснуться, Боль"
fowl,Fever,Respiratory distress,Occular discharge,Mouth lesion,Nasal Discharge,Yes,птица,"Высокая температура, Респираторный дистресс, Глазное выделение, Поражение рта, Носовая выделение"
fowl,Fever,Wound lesion,Excess salivary,Difficult in walking,Pain,Yes,птица,"Высокая температура, Поражение раны, Избыток слюны, Трудно в ходьбе, Боль"
fowl,Emaciation,Edema in lower jaw,Coughing,Shivering,Anemia,Yes,птица,"Истощение, Отек в нижней челюсти, Кашель, Дрожь, Анемия"
buffaloes,Fever,Reduce growth,Kid moratality,Weakness,Dullness,Yes,хомячок,"Высокая температура, Уменьшить рост, Детская смертность, Слабость, Тупость"
buffaloes,Fever,Reduce growth,Edema in lower jaw,Weight loss,Anemia,Yes,хомячок,"Высокая температура, Уменьшить рост, Отек в нижней челюсти, Потеря веса, Анемия"
buffaloes,Emaciation,Diarrhea,Kid moratality,Weakness,Anemia,Yes,хомячок,"Истощение, Диарея, Детская смертность, Слабость, Анемия"
buffaloes,SkinAllergy,Reduce growth,Wound,Head ache,Dizziness,Yes,хомячок,"Аллергия на кожи, Уменьшить рост, Ранить, Головная боль, Головокружение"
buffaloes,Watering of eyes,Redness of white of the eye,Swelling of eyelid,Cornea become cloudy,Tear production,Yes,хомячок,"Полив глаз, Покраснение белого глаза, Отек века, Роговица становится облачной, Слезное производство"
buffaloes,Berberi,Wasting,Nervous,Weight loss,Anorexia,Yes,хомячок,"Бербери, Впустую, Нервный, Потеря веса, Анорексия"
buffaloes,Gastritis,morbidity,Bloody,Mortality,Anemia,Yes,хомячок,"Гастрит, заболеваемость, Кровавый, Смертность, Анемия"
buffaloes,Fever,Severe headache,Vomiting,Coughing,Fatique,Yes,хомячок,"Высокая температура, Сильная головная боль, Рвота, Кашель, Фатик"
buffaloes,Fever,Tiredness,Swollen kidney,Hematuria,Muscle aches,Yes,хомячок,"Высокая температура, Усталость, Опухшая почка, Гематурия, Мышечные боли"
buffaloes,Fever,Diarrhea,Decreased appetite,Vomiting,Bloody,Yes,хомячок,"Высокая температура, Диарея, Снижение аппетита, Рвота, Кровавый"
buffaloes,Gas,Diarrhea,Abdominal discomfort,Vomiting,Nausea,Yes,хомячок,"Газ, Диарея, Брюшная дискомфорт, Рвота, Тошнота"
buffaloes,Drooping ears,Lack of coordination,Drooling,Wasting,Listlessness,Yes,хомячок,"Опубликовывающие уши, Отсутствие координации, Слюни, Впустую, Вялость"
buffaloes,Edema,diarrhea,Nasal Discharge,Decresed egg production,Sneezing,Yes,хомячок,"Отек, диарея, Носовая выделение, Снижение производства яиц, Чихание"
buffaloes,Drooping wings,Depression,Nasal Discharge,Coughing,Greenish diarrhea,No,хомячок,"Опубликовывающие крылья, Депрессия, Носовая выделение, Кашель, Зеленоватая диарея"
buffaloes,Weakness,Yellow or green dropping,Purplish combs,Wattles,Drop on egg production,No,хомячок,"Слабость, Желтый или зеленый падение, Пурпурные расчески, Wattles, Падать на производство яиц"
buffaloes,Neck paralysis,Diarrhea,ruffled feathers,Labored breathing,Weakness,No,хомячок,"Паралич шеи, Диарея, рюшат перья, Затрудненное дыхание, Слабость"
buffaloes,Facial Swelling,Lacrimation,Diarrhea,Anorexia,Nasal Discharge,No,хомячок,"Отек лица, Лэктримация, Диарея, Анорексия, Носовая выделение"
buffaloes,loss of appetite,Depression,Paralyzed leg,Weight loss,Anemia,No,хомячок,"потеря аппетита, Депрессия, Парализованная нога, Потеря веса, Анемия"
buffaloes,Dejection,Loss of appetite,Slow growth,Diarrhea,Lesion,No,хомячок,"Уныние, Потеря аппетита, Медленный рост, Диарея, Поражение"
buffaloes,Severe swellimg,Heavy Breathing,Diarrhea,Weight loss,Pain,No,хомячок,"Тяжелый отек, Тяжелое дыхание, Диарея, Потеря веса, Боль"
buffaloes,Weakness,Diarrhea,High moratality,Dehydration,Anorexia,No,хомячок,"Слабость, Диарея, Высокая смертность, Обезвоживание, Анорексия"
buffaloes,Fever,Hepatitis,Skin rashes,Weight loss,Pain,No,хомячок,"Высокая температура, Гепатит, Кожная сыпь, Потеря веса, Боль"
buffaloes,Sneezing,Epistaxis,Coughing,Difficulty in breathing,Nasal Discharge,No,хомячок,"Чихание, Эпистаксис, Кашель, Трудность в дыхании, Носовая выделение"
buffaloes,Sneezing,Unilateral Nasal discharge,Gagging,Retching,Weight loss,Yes,хомячок,"Чихание, Односторонний носовый выписка, Заталкивать, Ретч, Потеря веса"
buffaloes,Fever,Depression,Coughing,Weight loss,Anorexia,Yes,хомячок,"Высокая температура, Депрессия, Кашель, Потеря веса, Анорексия"
buffaloes,Shallow breathing,Halitosis,Coughing,Lethargy,Nasal Discharge,Yes,хомячок,"Мелкое дыхание, Галитоз, Кашель, Летаргия, Носовая выделение"
buffaloes,Dyspnea,Sneezing,Coughing,Difficulty in breathing,Infection,Yes,хомячок,"Одышка, Чихание, Кашель, Трудность в дыхании, Инфекция"
buffaloes,Dyspnea,Sneezing,Coughing,Difficulty in breathing,Pain,Yes,хомячок,"Одышка, Чихание, Кашель, Трудность в дыхании, Боль"
buffaloes,Fever,Rhinorrhea,Coughing,Sneezing,Dehydration,Yes,хомячок,"Высокая температура, Ринорея, Кашель, Чихание, Обезвоживание"
buffaloes,Fever,Rhinorrhea,Coughing,Facial edema,Dyspnea,Yes,хомячок,"Высокая температура, Ринорея, Кашель, Отек лица, Одышка"
buffaloes,Fever,Rhinorrhea,Coughing,Sneezing,Nasal Discharge,Yes,хомячок,"Высокая температура, Ринорея, Кашель, Чихание, Носовая выделение"
buffaloes,Mortality,Painfull,Coughing,Weight loss,Nasal Discharge,Yes,хомячок,"Смертность, Болезненный, Кашель, Потеря веса, Носовая выделение"
buffaloes,Skin rashes,Diarrhea,Death,Facial edema,Pain,Yes,хомячок,"Кожная сыпь, Диарея, Смерть, Отек лица, Боль"
buffaloes,Fever,Dyspnea,Coughing,Lethargy,Weightloss,Yes,хомячок,"Высокая температура, Одышка, Кашель, Летаргия, Потеря веса"
buffaloes,Fever,Dyspnea,Coughing,weakness,Anorexia,Yes,хомячок,"Высокая температура, Одышка, Кашель, слабость, Анорексия"
buffaloes,Facial edema,Dyspnea,Conjuctivtis,Weakness,Pharyngitis,Yes,хомячок,"Отек лица, Одышка, Конъюнктивит, Слабость, Фарингит"
buffaloes,Fever,Pneumonia ,Congestion,Lethargy,Nasal Discharge,Yes,хомячок,"Высокая температура, Пневмония , Скопление, Летаргия, Носовая выделение"
buffaloes,Fever,Death,Coughing,Weight loss,Nasal Discharge,Yes,хомячок,"Высокая температура, Смерть, Кашель, Потеря веса, Носовая выделение"
buffaloes,Sneezing,Convulsion,Seizuers,Weight loss,Nasal Discharge,Yes,хомячок,"Чихание, Судорога, Припадки, Потеря веса, Носовая выделение"
buffaloes,Fever,Death,Coughing,Dyspnea,Anorexia,Yes,хомячок,"Высокая температура, Смерть, Кашель, Одышка, Анорексия"
buffaloes,Dyspnea,Difficulty in breathing,Coughing,Lethargy,Nasal Discharge,Yes,хомячок,"Одышка, Трудность в дыхании, Кашель, Летаргия, Носовая выделение"
buffaloes,Air sacculitis,Halitosis,Coughing,Enteritis,Weight loss,Yes,хомячок,"Воздушный саккулит, Галитоз, Кашель, Энтерит, Потеря веса"
buffaloes,Fever,Convulsion,Sudden death,Urine retention,Weight loss,Yes,хомячок,"Высокая температура, Судорога, Внезапная смерть, Удержание мочи, Потеря веса"
buffaloes,Dyspnea,Neurologic sign,Coughing,Depression,Anorexia,Yes,хомячок,"Одышка, Неврологический знак, Кашель, Депрессия, Анорексия"
buffaloes,Fever,Dyspnea,Coughing,Lethargy,Anorexia,Yes,хомячок,"Высокая температура, Одышка, Кашель, Летаргия, Анорексия"
buffaloes,Labored breathing,Dyspnea,Coughing,Depression,Anorexia,Yes,хомячок,"Затрудненное дыхание, Одышка, Кашель, Депрессия, Анорексия"
buffaloes,Blood from mouth,Diarrhea,Coughing,Lethargy,Weight loss,Yes,хомячок,"Кровь из уст, Диарея, Кашель, Летаргия, Потеря веса"
buffaloes,Hemopytsis,Diarrhea,Asymptomatic,Death,Epistaxis,Yes,хомячок,"Кровоофхема, Диарея, Бессимптомный, Смерть, Эпистаксис"
buffaloes,Restlessness,Weakness,Blue straws,Death,Pain,Yes,хомячок,"Беспокойство, Слабость, Синяя соломка, Смерть, Боль"
buffaloes,Stripped remiges,Less Feather growth,Ruffled feathers,Defienciency in vitamin,Diarrhea,Yes,хомячок,"Разряженные, Меньше роста перьев, Рюшат перья, Дефицит витамина, Диарея"
buffaloes,Apathy,Depression,Dilation of duodenum,Cloacal pasting,Congestion,Yes,хомячок,"Апатия, Депрессия, Дилатация двенадцатиперстной кишки, Клоакальное вставка, Скопление"
buffaloes,Lepatomegaly,Splenomegaly,Vomiting,Swollen,Shaking oh head,Yes,хомячок,"Гепатомегалия, Спленомегалия, Рвота, Вздутый, Стремление головы"
buffaloes,Balance problem,Abdominal destention,Neck Paralysis,Weight loss,Pains,Yes,хомячок,"Проблема с балансом, Брюшная растяжение, Паралич шеи, Потеря веса, Боли"
buffaloes,Legness,Paresis,Coughing,Weight loss,Shortness of breath,Yes,хомячок,"Нога, Парез, Кашель, Потеря веса, Одышка"
buffaloes,Fever,Sour Throat,Mortality,Muscle aches,Abnormalities,Yes,хомячок,"Высокая температура, Кислое горло, Смертность, Мышечные боли, Аномалии"
buffaloes,Difficulty in feeding,Preening,Weakness,Beak overgrowth,Anemia,Yes,хомячок,"Сложность в кормлении, Притягивать, Слабость, Избыточный рост клюва, Анемия"
buffaloes,Fever,Loss of appetite,Ear infection,Depression,Nasal Discharge,Yes,хомячок,"Высокая температура, Потеря аппетита, Ушная инфекция, Депрессия, Носовая выделение"
buffaloes,Forthy eye,Torticollis,Weakness,Swelling,Emaciation,Yes,хомячок,"Краткий глаз, Кривошея, Слабость, Припухлость, Истощение"
buffaloes,Inappentence,Diarrhea,Tremors of the head,Dehydration,Weight loss,Yes,хомячок,"Неподходящее, Диарея, Толчок головы, Обезвоживание, Потеря веса"
buffaloes,Lack of walking,Lack of flying,Roughened,Dehydration,Pains,Yes,хомячок,"Отсутствие ходьбы, Отсутствие полета, Шероховатый, Обезвоживание, Боли"
buffaloes,Skin rashes,Small and yellow bumps,Swelling,Dry Scabs,Lameness,Yes,хомячок,"Кожная сыпь, Маленькие и желтые удары, Припухлость, Сухие струпки, Хромота"
buffaloes,Scabs On feet,Redness ,Trachea,Thickening of skin,Pains,Yes,хомячок,"Скабсы на ногах, Покраснение, Трахея, Утолщение кожи, Боли"
buffaloes,Enlarged Thymus,Obstructed Lungs,Lethargy,Skin rashes,Weight loss,Yes,хомячок,"Увеличенный тимус, Затрудненные легкие, Летаргия, Кожная сыпь, Потеря веса"
buffaloes,Fluffed Feather,Loss of appetite,Coughing,Vomiting,Snoring,Yes,хомячок,"Пухлое перо, Потеря аппетита, Кашель, Рвота, Храп"
buffaloes,Fever,Difficultty in Breathing,Yellow Eye,Sneezing,Diphtherictic,Yes,хомячок,"Высокая температура, Трудность в дыхании, Желтый глаз, Чихание, Дифтериктический"
buffaloes,Heavy Breathing,Yellow in beak,Tail_Bobbing,Weakness,Sleeping Excessively,Yes,хомячок,"Тяжелое дыхание, Желтый в клюве, Tail_bobbing, Слабость, Спать чрезмерно"
buffaloes,Puffed_up Feather,Less Eat,Headache,Half-closed eye,Seizures,Yes,хомячок,"Пухлый перо, Меньше еды, Головная боль, Полузакрытый глаз, Припадки"
buffaloes,Fever,Diarrhea,Swollen Abdomen,Vomiting,Difficulty in Breathing,Yes,хомячок,"Высокая температура, Диарея, Опухший живот, Рвота, Трудность в дыхании"
buffaloes,Tail Wagging,Straining,Lethargy,Weakness,Diarrhea,Yes,хомячок,"Хвост виляет, Напряжение, Летаргия, Слабость, Диарея"
buffaloes,Overweight,Loss of Appetite,Ruffled feathers,Depression,Diarrhea,Yes,хомячок,"Избыточный вес, Потеря аппетита, Рюшат перья, Депрессия, Диарея"
buffaloes,Dejection,Loss of Appetite,Stress,Coughing,Pains,Yes,хомячок,"Уныние, Потеря аппетита, Стресс, Кашель, Боли"
buffaloes,Skin infection,Secondary Infection,Coughing,Depression,Shaking oh head,Yes,хомячок,"Кожная инфекция, Вторичная инфекция, Кашель, Депрессия, Стремление головы"
buffaloes,Discharge From eyes,Lethargy,Coughing,Sneezing,Fatique,Yes,хомячок,"Выброс из глаз, Летаргия, Кашель, Чихание, Фатик"
buffaloes,Fever,Chills,Retarded Growth,Chest Pain,Chest Pain,Yes,хомячок,"Высокая температура, Озноб, Отсталый рост, Боль в груди, Боль в груди"
buffaloes,Pale comb,Lame,Death,Swolling of joint,Eye closed,Yes,хомячок,"Бледный расчет, Хромой, Смерть, Отек сустава, Глаз закрыт"
buffaloes,Lethargy,Loss of appetite,Difficulty in Swallowing,Weakness,Vision Problem,Yes,хомячок,"Летаргия, Потеря аппетита, Сложность в глотании, Слабость, Проблема зрения"
buffaloes,Emaciation,Difficulty in breathing,Vomiting,Weakness,Diarrhea,Yes,хомячок,"Истощение, Трудность в дыхании, Рвота, Слабость, Диарея"
buffaloes,Liquid Dropping,Exhaustion,Ataxia,Lethargy,Seizures,Yes,хомячок,"Жидкость падает, Истощение, Атаксия, Летаргия, Припадки"
buffaloes,Undigested in their feces,Loss of Appetite,Loss of pigment,Weakness,Bloody in feather,Yes,хомячок,"Непереваренные в их кале, Потеря аппетита, Потеря пигмента, Слабость, Кровавый в перьев"
buffaloes,Sharp Feather,Clubbed Feather,Eye disharge,Loss of powder down,Diarrhea,Yes,хомячок,"Острые перо, Забитое перо, Сброс глаз, Потеря порошка вниз, Диарея"
buffaloes,Ruffled Appearance,Loss of Appetite,Vomiting,Green Dropping,Nasal Discharge,Yes,хомячок,"Рюшат, Потеря аппетита, Рвота, Зеленый падение, Носовая выделение"
buffaloes,Sinuses,Swollen Eyelids,Skin rashes,Sneezing,Misshapen Beak,Yes,хомячок,"Пазухи, Опухшие веки, Кожная сыпь, Чихание, Средства"
buffaloes,Feather Loss,Feather Plucking,Coughing,Itching,Nasal Discharge,Yes,хомячок,"Потеря перья, Пехой склад, Кашель, Зуд, Носовая выделение"
buffaloes,Watery Eyes,Eye closed,Weight loss,Sneezing,Nervous Issue,Yes,хомячок,"Водянистые глаза, Глаз закрыт, Потеря веса, Чихание, Нервная проблема"
buffaloes,Bony Lesion,Skin Rashes,Ataxia,Anorexia,Weakness,Yes,хомячок,"Костное поражение, Кожная сыпь, Атаксия, Анорексия, Слабость"
buffaloes,Tremor of head and neck,Blindness,Kicking at the belly,Exercise in tolerance,Pains,Yes,хомячок,"Тремор головы и шеи, Слепота, Пинать в живот, Упражнения в терпимости, Боли"
buffaloes,Swollen Belly,Dullness,Discharge,Urination,Lying down,Yes,хомячок,"Опухший живот, Тупость, Увольнять, Мочеиспускание, Лежа"
buffaloes,Fever,Dullness,Depression,Weight loss,Anorexia,Yes,хомячок,"Высокая температура, Тупость, Депрессия, Потеря веса, Анорексия"
buffaloes,Fever,Succumb,Spread of infection,Weight loss,Anorexia,Yes,хомячок,"Высокая температура, Поддаться, Распространение инфекции, Потеря веса, Анорексия"
buffaloes,Signs in rams,Signs in ewe,Underdeveloped muscles,Semen Examination,Reduce Lamp marking,Yes,хомячок,"Знаки в Рамсе, Знаки в овце, Недоразвитые мышцы, Экзамен спермы, Уменьшить маркировку лампы"
buffaloes,Spines,Unusally thin,Weakness,Enlarged skulls,Weakness,Yes,хомячок,"Шипы, Необычно тонкий, Слабость, Увеличенные черепа, Слабость"
buffaloes,Discharge ,Sudden Abortion,Hemoglobinuria,Death of lamb,Weight Loss,Yes,хомячок,"Увольнять, Внезапный аборт, Гемоглобинурия, Смерть ягненка, Потеря веса"
buffaloes,Fever,Hemolytic anemia,Sweats,congestion,Jaundice,Yes,хомячок,"Высокая температура, Гемолитическая анемия, Пот, скопление, Желтуха"
buffaloes,Fever,Tiredness,loss of appetite,Muscle aches,Chest Pain,Yes,хомячок,"Высокая температура, Усталость, потеря аппетита, Мышечные боли, Боль в груди"
buffaloes,Excess salivation,Diarrhea,Depression,Nasal discharge,Weakness,Yes,хомячок,"Избыточное слюноотделение, Диарея, Депрессия, Носовая выделение, Слабость"
buffaloes,Fever,Diarrhea,Incoordination,Abortion,Blood Poisioning ,Yes,хомячок,"Высокая температура, Диарея, Нарушение, Аборт, Отравление крови"
buffaloes,Fever,Wasting,Dehydration,Deability,Weakness,Yes,хомячок,"Высокая температура, Впустую, Обезвоживание, Девственность, Слабость"
buffaloes,Fever,Diarrhea,Muscle twiching,Lameness,Weight loss,Yes,хомячок,"Высокая температура, Диарея, Мышечная подергивание, Хромота, Потеря веса"
buffaloes,Teeth griding,Apathy,Dehydration,Ruminal stasis,Watery faeces,No,хомячок,"Зубы шлифование, Апатия, Обезвоживание, Румана, Водянистые фекалии"
buffaloes,Fever,Depression,Lying down,Weak Pulse,Colic,Yes,хомячок,"Высокая температура, Депрессия, Лежа, Слабый пульс, Колики"
buffaloes,Swelling,Lameness,Hyperaestesia,Hock joint,Weight loss,Yes,хомячок,"Припухлость, Хромота, Гиперээзтерия, Шарнир, Потеря веса"
buffaloes,Head tilt,Circling,Muscles ache,Blindness,Seizures,Yes,хомячок,"Наклон головы, Кругим, Мышцы болится, Слепота, Припадки"
buffaloes,Decreased growth of bone,Depression,Grunting,Lameness,Weight loss,Yes,хомячок,"Снижение роста кости, Депрессия, Ворчание, Хромота, Потеря веса"
buffaloes,Swollen left abdomen,Lying Down,Staggering,Urination,Extension of neck,Yes,хомячок,"Опухший влево живот, Лежа, Ошеломляющий, Мочеиспускание, Расширение шеи"
buffaloes,Cessation of eructation,Difficulty in breathing,Depression,Anorexia,Colic,Yes,хомячок,"Прекращение эрекции, Трудность в дыхании, Депрессия, Анорексия, Колики"
buffaloes,Fever,Excession Salivation,Abnormal conformation,Ulcerated muscle,Ulcerated ear,Yes,хомячок,"Высокая температура, Избыток слюна, Ненормальная конформация, Изъязвленная мышца, Язвенный ухо"
buffaloes,Barren ewes,Abortion,Poor conformation,Hairy Fleeces,Weight loss,Yes,хомячок,"Бесплодные овцы, Аборт, Плохая конформация, Волосатые ручки, Потеря веса"
pig,Tremor ,Viability,Coughing,Anorexia,Weight Loss,Yes,хомячок,"Тремор, Жизнеспособность, Кашель, Анорексия, Потеря веса"
pig,Fever,Tachypea,Swelling of head and neck,Anorexia,Nasal Discharge,Yes,хомячок,"Высокая температура, Тахипноя, Отек головы и шеи, Анорексия, Носовая выделение"
pig,lllthrift,Skin Lesion,Lameness,Swelling on theBody,Weight loss,Yes,хомячок,"Lllthrift, Повреждение кожи, Хромота, Отек на теле, Потеря веса"
pig,Swelling,Heat,Flank,Pain,Nasal Discharge,Yes,хомячок,"Припухлость, Нагревать, Фланг, Боль, Носовая выделение"
pig,Fever,Loss of appetite,Lameness,Rump,Weight Loss,Yes,хомячок,"Высокая температура, Потеря аппетита, Хромота, Навес, Потеря веса"
pig,Fever,Swelling,loss of appetite,Anorexia,Weight Loss,Yes,хомячок,"Высокая температура, Припухлость, потеря аппетита, Анорексия, Потеря веса"
