AnimalName,symptoms1,symptoms2,symptoms3,symptoms4,symptoms5,Dangerous,AnimalClass,Симптомы_рус
dog,Fever,Diarrhea,Vomiting,Weight loss,Dehydration,Yes,собака,"Высокая температура, Диарея, Рвота, Потеря веса, Обезвоживание"
dog,Fever,Diarrhea,Coughing,Tiredness,Pains,Yes,собака,"Высокая температура, Диарея, Кашель, Усталость, Боли"
dog,Fever,Diarrhea,Coughing,Vomiting,Anorexia,Yes,собака,"Высокая температура, Диарея, Кашель, Рвота, Анорексия"
dog,Fever,Difficulty breathing,Coughing,Lethargy,Sneezing,Yes,собака,"Высокая температура, Трудности дыхание, Кашель, Летаргия, Чихание"
dog,Fever,Diarrhea,Coughing,Lethargy,Blue Eye,Yes,собака,"Высокая температура, Диарея, Кашель, Летаргия, Синий глаз"
dog,Fever,Respiratory distress,Seizuers,Hyperesthesia,Sudden death,Yes,собака,"Высокая температура, Респираторный дистресс, Припадки, Гиперестезия, Внезапная смерть"
dog,Ulcers,Diarrhea,Poor Appetite,Tarry Stool,Enlarged lymph nodes,Yes,собака,"Язвы, Диарея, Плохой аппетит, Тарри -стул, Увеличенные лимфатические узлы"
dog,Facial Swelling,Bloody Drool,Foul Breath,Unable To Eat,Lossened Teeth,Yes,собака,"Отек лица, Кровавый слюни, Неловкий дыхание, Невозможно поесть, Утраченные зубы"
dog,Fever,Difficulty breathing,Thrist and urination,Weight loss,Enlarged lymph nodes or Swelling,Yes,собака,"Высокая температура, Трудности дыхание, Жажда и мочеиспускание, Потеря веса, Увеличенные лимфатические узлы или отек"
dog,Swelling on leg,Painfull,Nasal Discharge,Broken Bones,Nasal Discharge,Yes,собака,"Отек на ноге, Болезненный, Носовая выделение, Сломанные кости, Носовая выделение"
dog,Short term lethargy,Loss of  appetite,Weekness in the back legs,Rapid Heart Rate,Week pulse,Yes,собака,"Краткосрочная летаргия, Потеря аппетита, Слабость в задних ногах, Быстрая частота сердечных сокращений, Недельный пульс"
dog,Swollen lymph nodes,Difficulty walking,Back Pain,Lethargy,Vaginal Discharge,Yes,собака,"Опухшие лимфатические узлы, Трудность ходьбы, Боль в спине, Летаргия, Вагинальный разряд"
dog,Fever,Diarrhea,Abdominal pain,Stiffness,Severe weekness and depression,Yes,собака,"Высокая температура, Диарея, Боль в животе, Жесткость, Сильная слабость и депрессия"
dog,Fever,Loss of  appetite,Reduce Energy,Lameness,Swelling of joints,Yes,собака,"Высокая температура, Потеря аппетита, Уменьшить энергию, Хромота, Обухание суставов"
dog,Fever,Chronic eye inflamation,Poor Appetite,Lethargy,Neurologic abnormalities,Yes,собака,"Высокая температура, Хроническое воспаление глаз, Плохой аппетит, Летаргия, Неврологические отклонения"
dog,Fever,Swelling of face or leg,Poor Appetite,Depression,Pains,Yes,собака,"Высокая температура, Отек лица или ноги, Плохой аппетит, Депрессия, Боли"
dog,Diarrhea with muscus,Tensemus,Watery Stool,Flatulence,Pains,Yes,собака,"Диарея с слизью, Тенсмус, Водянистый стул, Метеоризм, Боли"
dog,Strong cough,Runny nose,Sneezing,Lethargy,Loss of appettite,Yes,собака,"Сильный кашель, Насморк, Чихание, Летаргия, Потеря аппетита"
dog,Fever,Inflammed eye,Coughing,Depression,Limping,Yes,собака,"Высокая температура, Воспаленный глаз, Кашель, Депрессия, Хромающий"
dog,Fever,Difficulty breathing,Coughing,Eye and Skin change,Unable to exercise,Yes,собака,"Высокая температура, Трудности дыхание, Кашель, Изменение глаз и кожи, Невозможно заниматься спортом"
dog,Fever,Loss of  appetite,Coughing,Lethargy,Joint Pain,Yes,собака,"Высокая температура, Потеря аппетита, Кашель, Летаргия, Боль в суставах"
dog,Lesions in the nasal cavity,Lesions on nose,Nose Bleeds,Noisy Breathing,Lesions on nose,Yes,собака,"Поражения в носовой полости, Поражения на носу, Нос кровотечение, Шумное дыхание, Поражения на носу"
dog,Hair loss,Dandruff,Darkened skin,Crusting of the skin,Ulcerated skin,Yes,собака,"Выпадение волос, Перхоть, Затемненная кожа, Кора кожи, Изъязвленная кожа"
dog,Greenish-yellow nasal discharge,Lack of pigmentation,Sneezing,Lethargy,Pain on face,Yes,собака,"Зеленовато-желтый носовой разряд, Отсутствие пигментации, Чихание, Летаргия, Боль на лице"
dog,Fever,Diarrhea,Poor Appetite,Weight loss,Vomitting,Yes,собака,"Высокая температура, Диарея, Плохой аппетит, Потеря веса, Рвота"
dog,Jaundice,Pneumonia ,Lession on the skin,pain ,Vomitting,Yes,собака,"Желтуха, Пневмония , Поражение на коже, боль, Рвота"
dog,Poor coat apperence ,Diarrhea,Vomiting,Weight loss,Dehydration,Yes,собака,"Плохое появление пальто, Диарея, Рвота, Потеря веса, Обезвоживание"
dog,Watering,No appp,Vomiting,Lethargy,Dehydration,Yes,собака,"Полив, Нет приложения, Рвота, Летаргия, Обезвоживание"
dog,Straining,Diarrhea,Vomiting,Weight loss,Blindness,Yes,собака,"Напряжение, Диарея, Рвота, Потеря веса, Слепота"
dog,Upset stomach,Diarrhea,Vomiting,Muscle pain,Muscle stiffness,Yes,собака,"Расстроен желудок, Диарея, Рвота, Мышечная боль, Мышечная жесткость"
dog,Upset stomach,Diarrhea,Coughing,Weight loss,Anaemia,Yes,собака,"Расстроен желудок, Диарея, Кашель, Потеря веса, Анемия"
dog,Allergic Reaction,Poor appetite,Coughing,Weight loss,Distended chest,Yes,собака,"Аллергическая реакция, Плохой аппетит, Кашель, Потеря веса, Расставленный грудь"
dog,Fever,Anoxeria,Weight loss,Lethargy,Pain,Yes,собака,"Высокая температура, Анорексия, Потеря веса, Летаргия, Боль"
dog,Limping,Willnot run to jump,Swelling ,Week legs,Pain on leg,Yes,собака,"Хромающий, Не бегите, чтобы прыгнуть, Припухлость, Недельные ноги, Боль на ноге"
cat,Fever,Eye ulcer,Congestion,Depression,Pink eye,Yes,кот,"Высокая температура, Язва глаз, Скопление, Депрессия, Розовый глаз"
cat,Pnemonia,Loss of  appetite,Eye disharge,Lameness,Arthritis,Yes,кот,"Пневмония, Потеря аппетита, Сброс глаз, Хромота, Артрит"
cat,Fever,Seizures,Hydrophobia,Jaw is dropped,Shyness or aggression,Yes,кот,"Высокая температура, Припадки, Гидрофобия, Челюсть сброшена, Застенчивость или агрессия"
cat,Bloody Urine,Diffculty breathing,Vomiting,Weight loss,Anorexia,Yes,кот,"Кровавая моча, Трудности дыхание, Рвота, Потеря веса, Анорексия"
cat,Loss of eat,Difficulty in breathing,Swelling ,Lameness,Neurologic abnormalities,Yes,кот,"Потеря еды, Трудность в дыхании, Припухлость, Хромота, Неврологические отклонения"
cat,Dark or black face,Diarrhea,Vomiting,Blood in faces,Pain,Yes,кот,"Темное или черное лицо, Диарея, Рвота, Кровь на лицах, Боль"
cat,Jaundice,Difficulty in breathing,Seizuers,Lethargy,Pale gums,Yes,кот,"Желтуха, Трудность в дыхании, Припадки, Летаргия, Бледные десны"
cat,Appetite varies,Diarrhea,Vomiting,Weight loss,Pain,Yes,кот,"Аппетит варьируется, Диарея, Рвота, Потеря веса, Боль"
cat,Loss of eat,Fell unwell,Lethargy,Weight loss,Skin issue,Yes,кот,"Потеря еды, Нездорово, Летаргия, Потеря веса, Проблема кожи"
cat,Sickness,Loss of  appetite,Vomiting,Weight loss,Raised growth or bump,Yes,кот,"Болезнь, Потеря аппетита, Рвота, Потеря веса, Повышенный рост или удар"
cat,Nasal Bleeding,Diffulty chewing,Swelling ,Weight loss,Anorexia,Yes,кот,"Носовое кровотечение, Трудность жевания, Припухлость, Потеря веса, Анорексия"
cat,Ulcers,Lesions ,Scabs,Lumps,"Bumps(black,grey or red)",Yes,кот,"Язвы, Поражения, Spabs, Комочки, Шишки (черный, серый или красный)"
cat,Gasc,Loss of  appetite,Blood in stool,Stomach growling,Black stool,Yes,кот,"Газ, Потеря аппетита, Кровь в табуретке, Рычание желудка, Черный табурет"
cat,Shaking head,Scartching ear,Black on ear,Bad smell,Red and inflammation ear,Yes,кот,"Дрожащая голова, Царапает ухо, Черный на ухо, Плохой запах, Красное и воспалительное ухо"
cat,Attacks,Loss of  appetite,Coughing,Weight loss,Periodic vommiting,Yes,кот,"Атаки, Потеря аппетита, Кашель, Потеря веса, Периодическая рвота"
cat,Blood stool,Diarrhea,Coughing,Weight loss,Anemia,Yes,кот,"Кровавый табурет, Диарея, Кашель, Потеря веса, Анемия"
cat,Nasal discharge,Nosebleeds,inflamed nostrils,Sneezing,Lound breathing,Yes,кот,"Носовая выделение, Носовые кровотечения, воспаленные ноздри, Чихание, Громкое дыхание"
cat,Polyuria,Loss of  appetite,Vomiting,Weight loss,Polydipsa,Yes,кот,"Полиурия, Потеря аппетита, Рвота, Потеря веса, Полидипсия"
cat,Exessive Urination,Change in gait,Vomiting,Weight loss,Inability to jump,Yes,кот,"Чрезмерное мочеиспускание, Изменение в походке, Рвота, Потеря веса, Неспособность прыгать"
cat,Convulsion,Loss of consciousness,chewing,Twitching,Salivating,Yes,кот,"Судорога, Потеря сознания, жевание, Дергается, Слюноотделение"
cat,Wheezing,Rapid Breathing,Coughing,Swallowing,Effort to breath,Yes,кот,"Хрипил, Быстрое дыхание, Кашель, Глотание, Усилие дышать"
cat,Jaundice,Weekness,Lethargy,Weight loss,Anorexia,Yes,кот,"Желтуха, НЕКОТОРЫ, Летаргия, Потеря веса, Анорексия"
cat,Lession on cat skin,Dandruff in cat coat,Red patches,Hair loss,Skin issue,Yes,кот,"Повреждение на коже кошки, Перхоть в кошачьем пальто, Красные пятна, Выпадение волос, Проблема кожи"
cat,Lethargy,Diarrhea,Vomiting,Discharge from eye,Anorexia,Yes,кот,"Летаргия, Диарея, Рвота, Разряд из глаз, Анорексия"
cat,Skin irritation,Scartching,Lethargy,Hair loss,Excessive grooming,Yes,кот,"Раздражение кожи, Царапание, Летаргия, Выпадение волос, Чрезмерный уход"
cat,Floopy muscle,Speech delay,Intellectual disability,Walking problem,Eye movements,Yes,кот,"Мышцы Floopy, Задержка речи, Интеллектуальная инвалидность, Проблема ходьбы, Движения глаз"
cat,Sensitivity to bright light,Disharge from affected eye,Inflammation,Clouded cornea,Rubbing eye,Yes,кот,"Чувствительность к яркому свету, Выписка от пораженного глаза, Воспаление, Облаженная роговица, Потирая глаза"
cat,Fever,Diarrhea,Vomiting,Cramps,Dehydration,Yes,кот,"Высокая температура, Диарея, Рвота, Судороги, Обезвоживание"
cat,Tenderness,Erythema,Swelling ,Scartch,Pain,Yes,кот,"Нежность, Эритема, Припухлость, Царапать, Боль"
cat,Fever,Diarrhea,Vomiting,Salivation,Decrease appetite,Yes,кот,"Высокая температура, Диарея, Рвота, Слюноотделение, Уменьшить аппетит"
cat,Scaly patches of skin,Sore,Scabs,Scartch,Hair loss,Yes,кот,"Чешуйчатые пятна кожи, Больной, Spabs, Царапать, Выпадение волос"
cat,Fatty stool,Diarrhea,Vomiting,Weight loss,Pain,Yes,кот,"Жирный стул, Диарея, Рвота, Потеря веса, Боль"
cat,Nausea,Loss of appetite,Vomiting,Firm,Distended stomach,Yes,кот,"Тошнота, Потеря аппетита, Рвота, Твердый, Расставленный желудок"
cat,Fever,Swelling  in the bite area,Lethargy,Limp,Pain,Yes,кот,"Высокая температура, Отек в зоне укуса, Летаргия, Хромать, Боль"
cat,Fever,Loss of appetite,Eyeproblem,Liver disease,Nuerological,Yes,кот,"Высокая температура, Потеря аппетита, Проблема с глазами, Болезнь печени, Неврологический"
cat,Fever,Mild sneezing,Coughing,Nasal,Ocular discharge,Yes,кот,"Высокая температура, Мягкое чихание, Кашель, Носовой, Глазное выделение"
rabbit,Most often none,Sneezing,Nasal Discharge,Dyspnea,Pain,Yes,хомячок,"Чаще всего нет, Чихание, Носовая выделение, Одышка, Боль"
rabbit,Fever,Diarrhea,Vomiting,Blood from mouth,Shock,Yes,хомячок,"Высокая температура, Диарея, Рвота, Кровь из уст, Шок"
rabbit,Discomfort,Diarrhea,Dry or dull hair,Grinding teeth,Pain,Yes,хомячок,"Дискомфорт, Диарея, Сухое или тусклые волосы, Измельчение зубов, Боль"
rabbit,Loss of appetite,Swelling,Nasal Discharge,Blindness,Lethargy,Yes,хомячок,"Потеря аппетита, Припухлость, Носовая выделение, Слепота, Летаргия"
rabbit,Rhinitis,Pneumonia ,abscessess,Torticollis,Septicemia,Yes,хомячок,"Ринит, Пневмония , абсцесса, Кривошея, Сепсис"
rabbit,Fever,Diarrhea,Enteritis,Weight loss,Stomach  cramps,Yes,хомячок,"Высокая температура, Диарея, Энтерит, Потеря веса, Желудочные судороги"
rabbit,Immediate death,Difficulty in breathing,Blue colored lip,Bloody discharge,Neurologic abnormalities,Yes,хомячок,"Немедленная смерть, Трудность в дыхании, Голубая окрашенная губа, Кровавые выписки, Неврологические отклонения"
rabbit,Fever,Pox lession on skin,Skin reashes,Nasal discharge,Mortality varies,Yes,хомячок,"Высокая температура, Поражение оспы на коже, Кожная сыпь, Носовая выделение, Смертность варьируется"
rabbit,Red on affected area,Horny growth,Wart-like growth,Red skin,Lesions on ear,Yes,хомячок,"Красный на пострадавшем районе, Возбужденный рост, Бородный рост, Красная кожа, Поражения на ухе"
rabbit,Fever,Chills,Skin ulcer,Exhaustion,Swollen and painfull,Yes,хомячок,"Высокая температура, Озноб, Язва кожи, Истощение, Опухший и болезненный"
rabbit,Watering Diarrhea,Depression,Emaciation,Ruffled Coat,Lethargy,Yes,хомячок,"Поливная диарея, Депрессия, Истощение, Рюшат, Летаргия"
cow,loss in weight,emaciation,loss of appetite,Weakness,diarrhoea,Yes,хомячок,"потеря веса, истощение, потеря аппетита, Слабость, диарея"
chicken,loss of appetite,diarrhea,swollen purple wattle,Swollen comb,Lameness,Yes,птица,"потеря аппетита, диарея, опухший фиолетовый плетение, Опухший расческа, Хромота"
chicken,loss of appetite,diarrhea,ruffled feathers,Weight loss,Inability to absorb nutrients,Yes,птица,"потеря аппетита, диарея, рюшат перья, Потеря веса, Неспособность поглощать питательные вещества"
chicken,egg production decreases,stunted growth,Blindness,Distinctive bumps,Facial swelling,Yes,птица,"Производство яиц уменьшается, Задержка роста, Слепота, Отличительные удары, Отек лица"
chicken,loss of appetite,thirst,ruffled feathers,Closed eyes,Diarrhea,Yes,птица,"потеря аппетита, жажда, рюшат перья, Закрытые глаза, Диарея"
cow,Fever,weakened legs,los of the ability to walk,Mammary glads,Fluif filled blisters,Yes,хомячок,"Высокая температура, ослабленные ноги, LOS способности ходить, Молочные железы, Заполненные жидкостью волдыри"
cow,Fever,weakened legs,los of the ability to walk,Weight loss,Lameness,Yes,хомячок,"Высокая температура, ослабленные ноги, LOS способности ходить, Потеря веса, Хромота"
cow, abortion at the end of gestation,Fatigue,weak calves,Join pains,Swelling of internal organs,Yes,хомячок,"аборт в конце беременности, Усталость, слабые телята, Присоединяйтесь к болам, Отек внутренних органов"
mammal,swollen,red-colored ,hot udder,Milk getting out more watery,Milk getting out more thick,Yes,хомячок,"вздутый, красный цвет, Горячий вымен, Молоко выходит более водянистого, Молоко выходит более толстое"
cow,Fever,Distress,Trembling,Staggering,Convulsion,Yes,хомячок,"Высокая температура, Бедствие, Дрожь, Ошеломляющий, Судорога"
cow,Fever,Animal become lame,Prostrat,Painfull Swalling,Lameness,Yes,хомячок,"Высокая температура, Животное становится хромым, Простата, Болезненное глотание, Хромота"
cow,Fever,Difficulty in breathing,Dribbling of saliva,Inability of Swalllon Feeding,Moist and painfull,Yes,хомячок,"Высокая температура, Трудность в дыхании, Дриблинг слюны, Неспособность кормления глобального, Влажный и болезненный"
cow,Fluif Faeces on blood and muscle,Sudden Death,Blooody Fluid,Red Diarrhea,Faeces are streake with blood,Yes,хомячок,"Жидкие фекалии на крови и мышцах, Внезапная смерть, Кровавая жидкость, Красная диарея, Феканист"
cow,Fever,Pneumonia ,Stand with head droping,Weight loss,Abnormal behaviour,Yes,хомячок,"Высокая температура, Пневмония , Стоять с падением головы, Потеря веса, Ненормальное поведение"
cow,Fever,Slightly Swollen,Lession on the skin,Milky Hard,Papules appear on teats anad udder,Yes,хомячок,"Высокая температура, Слегка опухший, Поражение на коже, Млечный жесткий, Папулы появляются на сосках и вымене"
cow,Fever,Dull,Hind quarted soil,Animal stop feed,Decrease in milk production,Yes,хомячок,"Высокая температура, Тупой, Задних квартала почва, Живота остановка корма, Снижение производства молока"
cow,Severe,Diarrhea,Blood on faces,Appetite,Milk reduce,Yes,хомячок,"Серьезный, Диарея, Кровь на лицах, Аппетит, Молоко уменьшается"
cow,Fever,Depression,Relunctance to move,Salivation,Nasal Discharge,Yes,хомячок,"Высокая температура, Депрессия, Нежелание двигаться, Слюноотделение, Носовая выделение"
cow,Normal appetite,Diarrhea,Swelling may occur under jaw,Weight loss,Drop in milk production,Yes,хомячок,"Нормальный аппетит, Диарея, Набухание может возникнуть под челюстью, Потеря веса, Падение производства молока"
cow,Swelling on leg,Heat,Hardness,Redness,Pain,Yes,хомячок,"Отек на ноге, Нагревать, Твердость, Покраснение, Боль"
cow,Inability to stand ,Diarrhea,Bottle Jaw,Pot belly,Dry Hair coat,Yes,хомячок,"Неспособность стоять, Диарея, Бутылка челюсть, Горшок живот, Сухой шерсть"
cow,Excitability,Nervousness,loss of appetite,Hyper sensitivity,Weakness,Yes,хомячок,"Возбудимость, Нервозность, потеря аппетита, Гиперчувствительность, Слабость"
cow,Fever,Depression,Attack,Bite other animals,Pain,Yes,хомячок,"Высокая температура, Депрессия, Атака, Укусить других животных, Боль"
cow,Fever,Difficulty in breathing,Coughing,Painfull,Eye become dull,Yes,хомячок,"Высокая температура, Трудность в дыхании, Кашель, Болезненный, Глаз стал скучным"
cow,Fever,Ulcer on gum,Red eye,Yellowish Discharge,Bloody Diarrhea,Yes,хомячок,"Высокая температура, Язва на жевательной резине, Красный глаз, Желтоватый разряд, Кровавая диарея"
cow,Fever,Diarrhea,Coughing,Consistency of milk,Pain,Yes,хомячок,"Высокая температура, Диарея, Кашель, Консистенция молока, Боль"
cow,Animal gets uneasy,Difficulty in breathing,Difficult in respiration,Excessive production,Stamping And pedding of hind eye,Yes,хомячок,"Животное становится неловким, Трудность в дыхании, Трудно в дыхании, Чрезмерное производство, Штамповка и ход задних глаз"
horse,Fever,Chills,Severe colic,Weakness,Anorexia,Yes,хомячок,"Высокая температура, Озноб, Тяжелый колик, Слабость, Анорексия"
horse,Fever,Body stiffness,Lethargy,Severe inflammation,Pain,Yes,хомячок,"Высокая температура, Жесткость тела, Летаргия, Тяжелое воспаление, Боль"
horse,Sickness,Diarrhea,Weight loss,Nausea,Dehydration,Yes,хомячок,"Болезнь, Диарея, Потеря веса, Тошнота, Обезвоживание"
horse,Sudden death,Trouble walking,Paralysis,Depression,Convulsion,Yes,хомячок,"Внезапная смерть, Проблема ходить, Паралич, Депрессия, Судорога"
horse,Fever,Abortion,Kidney failure,Inflammation of eye,Eye redness,Yes,хомячок,"Высокая температура, Аборт, Почечная недостаточность, Воспаление глаз, Глаза покраснение"
horse,Small red bumps,Pneumonia ,Septic Arthritis,Skin infection,Pain,Yes,хомячок,"Маленькие красные удары, Пневмония , Септический артрит, Кожная инфекция, Боль"
horse,Fever,Ataxia,Aggressiveness,Depression,Obscure Lameness,Yes,хомячок,"Высокая температура, Атаксия, Агрессивность, Депрессия, Неясная хромота"
